name,id,tier,rarity,tech/manufacturer,tags,uiTags,base value,unlocked,hidden,hiddenEverywhere,cost_frigate,cost_dest,cost_cruiser,cost_capital,script,desc,short,sModDesc,sprite
Lightweight Hull,lightweight_hull,0,,,"req_spaceport, merc, standard","Special, Requires Dock",4000,TRUE,,,5,10,15,25,data.hullmods.LightweightHull,"Uses lightweight material in the construction of the hull, significantly reduces the ship's tonnage.

Reduces fuel use by %s.
Increases maximum burn level by %s.
Increases the ship's maneuverability by %s.
Increases the ship's top speed in combat by %s.
Reduces hull integrity by %s.
Reduces armor by %s.",Reduces fuel usage and increases mobility.,,graphics/hullmods/lightweight_hull.png
